{
  "$schema": "https://roblox-top1.local/schemas/transfer-report.schema.json",
  "schemaVersion": "1.0.0",
  "assetId": "turret_fast_v1",
  "generatedAt": "2026-07-17T22:30:08.090315Z",
  "rendererTruth": "BLENDER_TRANSFER_PREFLIGHT_HUMAN_AND_STUDIO_AUTHORITIES_REMAIN_SEPARATE",
  "automatedStatus": "PASS",
  "automatedScore": 100,
  "overallStatus": "PARTIAL",
  "inputHashes": {
    "contract": "39e5f42a92e827db15e65e2b15f9896cfe49ec16acb3361ab68d2b11849c23ab",
    "humanReview": "6a5953aba6d1a988d53a84f7669ba51cfb57ac78d7c975bd2320b2faede17297",
    "generator": "6c42e886db73922ead657dbb423b92e9a22f9541612cdf371731b1c093e43362",
    "proofBuilder": "0b1fedbd93ca9f52b6b82d4e36466fc3f788e57d3816111f275ea748ea1161ac",
    "transferBuildValidator": "77e0b94ac37de1fb491e5e1c9eeeefb3be6a7ca211c27eee1f462f97649eec21",
    "metricLibrary": "705628d2ea387b52384f15d7e2a0456db38724a3bb994e01147d4461b9e11122",
    "baseCompiler": "56595b8c3e615f19ff84d4f9e52969d9a63be0c6b48150d29173b0f4a3016880",
    "shapeLanguage": "76fcd0eaaace7f34d7fb88fdc6470315518efd8e586649393ceb32356a7addc7",
    "semanticPalette": "10898d004894a0bdd45f69c2dbdf72f079ab41c455f0016f5f7867ded7e0225c",
    "materials": "41fadb667eb50a2252e6721649afee1b38b98a667ea7c2051f5f465ad9896b83",
    "camera": "f2daf7d92ff4db38a588cb29588c5856c8894ec0c11d30d3d01c527bf7cd8d44",
    "lighting": "8e3db2df064ac33f79703e21aa702709a7162fa43b56d07f706e3af03647e085",
    "industrial-toy-defense": "2e93bda4c5069f1f800cd14994bf1afa0aa5e89d514ef2675fe06deb25cd3f66",
    "salvaged-frontier": "3b59d12273d24e5aea3b7a06611aafffad495f482a1696dc4a1c1fc41749f3d6",
    "clean-tactical-diorama": "7630f436fbcff05e5761adcbf2f0c70faec1eb41b12340e7c42c5cc75f61adec"
  },
  "thresholds": {
    "minimumMaskAreaRatio": 0.01,
    "maximumFrameContactPixels": 0,
    "minimumDamagedDifference": 0.012,
    "minimumCriticalDifference": 0.045,
    "minimumCriticalLead": 0.008,
    "minimumCrossTerritoryDifference": 0.04,
    "minimumFrontBackDifference": 0.025,
    "minimumFarBboxHeightRatio": 0.035,
    "minimumPortraitBboxHeightRatio": 0.18
  },
  "territories": [
    {
      "territoryId": "industrial-toy-defense",
      "status": "PASS",
      "fullBuildReportSha256": "00aa5313ee09acc5ff30499a51c3a57ab0b45cd354834b226bbe6cc41d295a49",
      "geometry": {
        "variantCount": 3,
        "maximumTriangles": 1148,
        "triangleBudget": 3500,
        "exportCount": 3,
        "fullRenderCount": 36
      },
      "grammarAuditStatus": "PASS",
      "determinism": {
        "status": "PASS",
        "runExitCodes": [
          0,
          0
        ],
        "canonicalReportSha256": "f89e538b50d08b65494eacf9ab6305f94a9b448dc9afc78b3afc730d322a7eda",
        "exportSha256": {
          "intact": "a89d7b7277c72ae9c3cb0fb0bc76c85867f3c2da6ae316b4b5ff5abf4430c8c6",
          "damaged": "80ba6a8d1fce1b70fcb8ce135f8f34840e8625aa936631e1043af6f1794d58d3",
          "critical": "0120d10c32390c5c5618c0398ee2da3bf83a0e070bda03fb0d553825cf949d88"
        }
      },
      "portableArtifacts": [
        {
          "kind": "BACK_SILHOUETTE",
          "stateId": "intact",
          "path": "evidence/transfer/turret-fast-v1/industrial-toy-defense/orientation/back_silhouette.png",
          "bytes": 202052,
          "sha256": "63dcbb25a767854a26709fbe59e2873bd8fdf160e3f29deddc6f2310a98db469"
        },
        {
          "kind": "FAR_MOBILE",
          "stateId": "critical",
          "path": "evidence/transfer/turret-fast-v1/industrial-toy-defense/far-mobile/critical.png",
          "bytes": 200959,
          "sha256": "0aa7b54f9e9ccc03acfee20ffe1f2627c0198789448ec2c0a01556822150d931"
        },
        {
          "kind": "FAR_MOBILE",
          "stateId": "damaged",
          "path": "evidence/transfer/turret-fast-v1/industrial-toy-defense/far-mobile/damaged.png",
          "bytes": 201341,
          "sha256": "7c95fb8a24fe589c7103c133877f4f78b8c88cdf61c18c8cf097ca487aea42c5"
        },
        {
          "kind": "FAR_MOBILE",
          "stateId": "intact",
          "path": "evidence/transfer/turret-fast-v1/industrial-toy-defense/far-mobile/intact.png",
          "bytes": 201133,
          "sha256": "24c97339a61f6b0779511aaba77f14e56b01ae6504862b3aca5e5863c896e4cc"
        },
        {
          "kind": "FRONT_SILHOUETTE",
          "stateId": "intact",
          "path": "evidence/transfer/turret-fast-v1/industrial-toy-defense/orientation/front_silhouette.png",
          "bytes": 202157,
          "sha256": "ff12df4d0f20dadf938d151829a5743a0c4a6048c8330a51b206f5b674bd135d"
        },
        {
          "kind": "GLB",
          "stateId": "critical",
          "path": "evidence/transfer/turret-fast-v1/industrial-toy-defense/exports/critical.glb",
          "bytes": 78956,
          "sha256": "0120d10c32390c5c5618c0398ee2da3bf83a0e070bda03fb0d553825cf949d88"
        },
        {
          "kind": "GLB",
          "stateId": "damaged",
          "path": "evidence/transfer/turret-fast-v1/industrial-toy-defense/exports/damaged.glb",
          "bytes": 92796,
          "sha256": "80ba6a8d1fce1b70fcb8ce135f8f34840e8625aa936631e1043af6f1794d58d3"
        },
        {
          "kind": "GLB",
          "stateId": "intact",
          "path": "evidence/transfer/turret-fast-v1/industrial-toy-defense/exports/intact.glb",
          "bytes": 89436,
          "sha256": "a89d7b7277c72ae9c3cb0fb0bc76c85867f3c2da6ae316b4b5ff5abf4430c8c6"
        },
        {
          "kind": "HERO",
          "stateId": "critical",
          "path": "evidence/transfer/turret-fast-v1/industrial-toy-defense/hero/critical.png",
          "bytes": 805177,
          "sha256": "c2dc9619bcf4f8c75549877416c4e41f6eaea3c2b622bfcb47feb88497b408e2"
        },
        {
          "kind": "HERO",
          "stateId": "damaged",
          "path": "evidence/transfer/turret-fast-v1/industrial-toy-defense/hero/damaged.png",
          "bytes": 844031,
          "sha256": "19f97a3428e2b20f8d482ac68f644bc2f5e96d816d9b6b1e9519514b07787843"
        },
        {
          "kind": "HERO",
          "stateId": "intact",
          "path": "evidence/transfer/turret-fast-v1/industrial-toy-defense/hero/intact.png",
          "bytes": 832283,
          "sha256": "4e175b36734617089cc9e8153f501610558e64c164d53ddef99ae25f987c62a7"
        },
        {
          "kind": "PORTRAIT_MOBILE",
          "stateId": "critical",
          "path": "evidence/transfer/turret-fast-v1/industrial-toy-defense/portrait-mobile/critical.png",
          "bytes": 216065,
          "sha256": "9d951b0beb67c72bfd023d167897e940816fd5ba1bb098651f4575dad98cb9a3"
        },
        {
          "kind": "PORTRAIT_MOBILE",
          "stateId": "damaged",
          "path": "evidence/transfer/turret-fast-v1/industrial-toy-defense/portrait-mobile/damaged.png",
          "bytes": 218467,
          "sha256": "5a91af812b900c129d6bd58e128e4d33d5cf6272eeaaeb005b88bdcca9dae3f1"
        },
        {
          "kind": "PORTRAIT_MOBILE",
          "stateId": "intact",
          "path": "evidence/transfer/turret-fast-v1/industrial-toy-defense/portrait-mobile/intact.png",
          "bytes": 218625,
          "sha256": "11a4776988eb363272e7374b997a89d1a8ca55d9067959e0899559a961b45ffa"
        },
        {
          "kind": "STATE_SILHOUETTE",
          "stateId": "critical",
          "path": "evidence/transfer/turret-fast-v1/industrial-toy-defense/state-silhouette/critical.png",
          "bytes": 201582,
          "sha256": "846ea61b4a8f1a188ebb5db86b1dbdefcb12cbd1ec7f6b42ad8d1f740cffa8f8"
        },
        {
          "kind": "STATE_SILHOUETTE",
          "stateId": "damaged",
          "path": "evidence/transfer/turret-fast-v1/industrial-toy-defense/state-silhouette/damaged.png",
          "bytes": 202077,
          "sha256": "c2d59533c2e6b9057ed2c0aaa4379643fed1c2d5dbc99e69269f52df53fb6764"
        },
        {
          "kind": "STATE_SILHOUETTE",
          "stateId": "intact",
          "path": "evidence/transfer/turret-fast-v1/industrial-toy-defense/state-silhouette/intact.png",
          "bytes": 201654,
          "sha256": "e20f60651c739c5892249bfeb0c80f7c0f8ec12c352df7f33f833ff659de9bba"
        }
      ],
      "silhouetteCases": [
        {
          "stateId": "critical",
          "path": "evidence/transfer/turret-fast-v1/industrial-toy-defense/state-silhouette/critical.png",
          "sha256": "846ea61b4a8f1a188ebb5db86b1dbdefcb12cbd1ec7f6b42ad8d1f740cffa8f8",
          "maskAreaRatio": 0.022096354166666665,
          "bboxWidthRatio": 0.134375,
          "bboxHeightRatio": 0.25833333333333336,
          "frameContactPixels": 0,
          "pass": true
        },
        {
          "stateId": "damaged",
          "path": "evidence/transfer/turret-fast-v1/industrial-toy-defense/state-silhouette/damaged.png",
          "sha256": "c2d59533c2e6b9057ed2c0aaa4379643fed1c2d5dbc99e69269f52df53fb6764",
          "maskAreaRatio": 0.025959201388888888,
          "bboxWidthRatio": 0.1484375,
          "bboxHeightRatio": 0.28055555555555556,
          "frameContactPixels": 0,
          "pass": true
        },
        {
          "stateId": "intact",
          "path": "evidence/transfer/turret-fast-v1/industrial-toy-defense/state-silhouette/intact.png",
          "sha256": "e20f60651c739c5892249bfeb0c80f7c0f8ec12c352df7f33f833ff659de9bba",
          "maskAreaRatio": 0.028936631944444444,
          "bboxWidthRatio": 0.15625,
          "bboxHeightRatio": 0.29444444444444445,
          "frameContactPixels": 0,
          "pass": true
        }
      ],
      "stateComparisons": [
        {
          "fromState": "intact",
          "toState": "damaged",
          "intersectionOverUnion": 0.8682422451994092,
          "differenceRatio": 0.13175775480059082,
          "minimumDifference": 0.012,
          "pass": true
        },
        {
          "fromState": "intact",
          "toState": "critical",
          "intersectionOverUnion": 0.6470093850679367,
          "differenceRatio": 0.3529906149320633,